Category,Title,Price,Image URL,Product Details,Author Name,Author Profile Link,Author Last Seen
"Електроника","Xiaomi Redmi Note 12 / 12S / 12 Pro / 12 Pro+ /Двоен 360 магнитен кейс","19.95 лв.","https://frankfurt.apollo.olxcdn.com:443/v1/files/bxbua772bx202-BG/image;s=216x152;q=50","Към кейса може да се добави 9H стъклен протектор за защита на задните камери. Камерите отзад излизат над кейса и са уязвими при удари и драскотини. За актуална цена на протектора за камера, моля попитайте. Предлага се за следните модели на Xiaomi: * Redmi Note 12 4G - глобална версия (включително България) * Redmi Note 12 5G - глобална версия (включително България) * Redmi Note 12S 4G * Redmi Note 12 Pro 4G * Redmi Note 12 Pro 5G * Redmi Note 12 Pro Plus 5G * Всички останали модели на Xiaomi и Poco могат да се видят в другите ни обяви. ВНИМАНИЕ: Всички гореописани модели са различни и не са съвместими. Пример: Redmi Note 12 Pro 4G е различен модел от Redmi Note 12 Pro 5G. Моля, при поръчка да напишете ясно дали искате за 4G или 5G версия на конкретния модел, защото аксесоарите са различни. Не приемаме поръчки в които не е отбелязано за коя версия се поръчва. Налични цветове на рамките: Черен *** Син *** Светлозелен *** Сребрист Снимки от 7 до 12 са реални на кейсове за Redmi Note 12 5G. ХАРАКТЕРИСТИКИ: > Има закалено стъкло и отпред на екрана и отзад на гърба. Осигурява 360 градусова защита на телефона, тъй като го затваря от всички страни. > Предното стъкло е тъч стъкло и може да се работи през него без калъфа да се отваря. > Съвместим с пръстов отпечатък, лицево разпознаване и безжично зареждане. > Състой се от горна и долна алуминиеви рамки които обикалят телефона от всички страни. Двете рамки се свързват с магнити и могат да се отделят една от друга. > В рамките и стъклата са изрязани всички необходими отвори за съответния модел. > Може да се отваря както хоризонтално, така и вертикално, тъй като магнитите са разположени по цялата обиколка на рамките и позволяват отваряне в двете посоки. > Лека конструкция със сериозна здравина благодарение на алуминиевите рамки и закалените стъкла. Предлагаме голямо разнообразие от стъклени протектори за екран и за задните камери, различни кейсове и кожени калъфи за телефони, таблети, смарт часовници и гривни. Всичко може да се види в другите ни обяви. Всички стоки могат да се закупят на място в София. Също изпращаме с куриер с наложен платеж и куриерска услуга за сметка на клиента. Работим САМО с Еконт с възможно най-голямата отстъпка от 30%. Цялата отстъпка предоставяме на нашите клиенти за да получат те възможно най-ниска цена на доставката. Необходими са ни име, телефонен номер и офис или адрес до който да изпратим стоката. Цени на доставката с Еконт (за един кейс) с включени 30% отстъпка от цената на доставката, такса наложен платеж, преглед, тест, застраховка и SMS известяване: > > До офис в населено място с офис на Еконт: 4.70 лв. > > До адрес в населено място с офис на Еконт: 5.90 лв. > > До адрес в населено място без офис на Еконт: 7 лв. Цените за доставката са актуални към месец Юни 2024 год. Възможно е отклонение от тези цени с няколко стотинки надолу или нагоре поради динамичната такса ""пътни условия"" която Еконт актуализират периодично. Доставките с Еконт до адрес в събота имат оскъпяване с около 2 лв., защото е почивен ден и трябва да бъдат извършени до 15:00 ч. Моля, използвайте правото си на ПРЕГЛЕД и ТЕСТ и ако има нещо нередно се свържете с нас незабавно, докато сте при куриера. Приемаме рекламация за повредена, липсваща или сгрешена стока само и единствено по време на преглед и тест. Към Еконт също може да се заяви рекламация за повредена или липсваща стока само след използван преглед и тест. Поради множеството злоупотреби от недобросъвестни клиенти, не заменяме стока когато някой друг вместо вас е взел пратката без да я провери или вие сте я взели без да я проверите и вкъщи (или след като е приета от куриер на адрес) сте установили, че има нещо нередно. Всяка пратка пътува със застраховка (обявена стойност), но за да е валидна тя при повредена стока, това трябва да се установи при прегледа пред куриера. Не носим отговорност за стока изпратена здрава от нас и повредена от Еконт, когато не използвате преглед!","HappY CaSe","https://www.olx.bghttp://happycase.olx.bg/home/","Последно онлайн днес в 13:23 ч."
"Електроника","Преса за коса CARRERA 534 Арган и кератин(постоянна йонизация)","60 лв.","https://frankfurt.apollo.olxcdn.com:443/v1/files/bxbua772bx202-BG/image;s=216x152;q=50","Не различима от нова,понеже е ползвана броени пъти. Характеристика: Преса за коса с йонизация Carrera Germany No.534 - Подвижни плочи за изправяне с дължина 110 мм и ширина 25 мм - Плочи, наситени с арганово масло и кератин за идеално блестяща коса - Йонизация - Настройка на температурата от 140 до 220 градуса C (на стъпки от 10 градуса C) - Светещ LED дисплей за цифров контрол на температурата - Функция за бързо загряване за 30 секунди - Защита срещу прегряване - Автоматично изключване след 30 минути - Въртящ се кабел на 360 градуса","Катерина","https://www.olx.bg/ads/user/I7NB/","Последно онлайн 13 ноември 2024 г."
"Електроника","Печка Bosh с керамичен плот","300 лв.","https://frankfurt.apollo.olxcdn.com:443/v1/files/bxbua772bx202-BG/image;s=216x152;q=50","В много добро състояние, нова е. С три керамични котлона и фурна.","krumivanov753","https://www.olx.bg/ads/user/onVal/","Последно онлайн 03 ноември 2024 г."
"Спорт, книги, хоби","!!! ТОП !!! Кралски Боксови Круши Ново 2024г. 2 години гаранция","2100 лв.","https://frankfurt.apollo.olxcdn.com:443/v1/files/dfu1k7wc0bvh1-BG/image;s=216x152;q=50","ТАЗИ ОБЯВА НЯМА НИЩО ОБЩО С ДРУГИ ОБЯВИ ЧЕТЕТЕ ВНИМАТЕЛНО!!! КАЧЕСТВО НАДЕЖНОСТ НАЙ-ВИСОКИЯТ КЛАС ЗА КРУША КРАЛСКИ БОКСОВИ КРУШИ Втора ръка 2100лв Новоизбирете качество 2500лв 1година гаранция 2800лв 2години гаранция 3000лв Комбо Боксови Круши 4800лв 1година гаранция 5000лв 2години гаранция 5200лв Джагита 1600лв 1години гаранция 1800лв 2години гаранзия 2000лв Въздушен Хокей 2800лв 1година гаранция 3000лв 2години гаранция 3200лв Кранове за играчки 3000лв Баскетбол 4400лв Клатушки 2500лв 1година 2700лв 2години 2900лв Машините ни са най-добрите на пазара от вносител НОВИ В ПАКЕТ ПРЕДЛАГАМЕ И ЧАСТИ ЗА ТЯХ Комбиниран Монетник 100лв Еталонен монетник 90лв Моторче 200лв Платка 550лв Фотосел 100лв Захранване 100лв Кожа 80лв Плондер 25лв Шпилка 60лв Комплект кожа топка шпилка болтове 150лв Намират се в Склада ни в Бургас ЗАПОВЯДАЙТЕ Имам превоз за цяла България 08******23","V-Автомати Развлекателни съоражения","https://www.olx.bg/ads/user/cmHmq/","Последно онлайн 07 ноември 2024 г."
"Спорт, книги, хоби","Калеври Puma Evo Power Нови","40 лв.","https://frankfurt.apollo.olxcdn.com:443/v1/files/dfu1k7wc0bvh1-BG/image;s=216x152;q=50","Калеври PUMA Evo Power с пластмасови бутони. Оригинални, производство във Виетнам с уникален производсвен номер. Номер: UK 9 1/2; EUR:44","Иван","https://www.olx.bg/ads/user/8Rur/","Последно онлайн 14 ноември 2024 г."
"Спорт, книги, хоби","Kaabo Wolf Warrior 11 2x1200 LG/35ah","5679 лв.","https://frankfurt.apollo.olxcdn.com:443/v1/files/dfu1k7wc0bvh1-BG/image;s=216x152;q=50","!!!ПРОМОЦИЯ!!! СТАРА ЦЕНА 5879лв. НОВА ЦЕНА 5679лв. НАЛИЧНИ БРОЙКИ!!! НОВ МОДЕЛ - ПОВИШЕНА ВОДОУСТОЙЧИВОСТ IPX5 НА СКУТЕРА И МОТОРИТЕ! Wolf Warrior 11 - ТОП 2 модел в света за 2020г! Мощност, комфорт и адреналин! Wolf Warrior 11 е мощен електрически скутер от серията на Kaabo, с два мотора с номинална мощност от по 1200W (над 4800W обща пикова мощност) и мощна Li-ion батерия от 60V/26 Ah или LG Li-ion 60V/35Ah! С този скутер можете да изминете разстояние до 150 км. Моделът с по-малката батерия е оборудван със стандартен LT-01 дисплей и контролер, а моделът с по-голямата батерия с LCD дисплей и контролер на Minimotors, предно двойно хидравлично и задно пружинно окачване, 11x3.5"" пневматични устойчиви на пукане (Run flat) гуми, двойни дискови хидравлични спирачки и електрически спирачни с EABS функция и регенерация на батерията, широка основа, силни LED светлини, електрически клаксон. Този модел е чудесен избор за хора, изминаващи ежедневно по-големи разстояния, търсещи по-голяма независимост и емоция при придвижването. Характеристиките на скутерът позволяват да бъде използван за екстремни терени и придвижване (Off-road), благодарение на различните режими на движение - Eco/Turbo, Single/Dual задвижване и Публикувай възможността за поставяне на Off-road гуми.","Kaabo Riders Zarata","https://www.olx.bghttp://kaabo-riders-zarata.olx.bg/home/","Последно онлайн 12 ноември 2024 г."
"Спорт, книги, хоби","Велосипед Dunlop 26”, цвят: син","200 лв.","https://frankfurt.apollo.olxcdn.com:443/v1/files/dfu1k7wc0bvh1-BG/image;s=216x152;q=50","Велосипед Dunlop 26”, цвят: син. За повече информация, моля звъннете на посочения телефон.","Марияна Андонова","https://www.olx.bg/ads/user/1fbh/","Последно онлайн днес в 15:59 ч."
"Спорт, книги, хоби","Каменни корита 150лв за беой","150 лв.","https://frankfurt.apollo.olxcdn.com:443/v1/files/dfu1k7wc0bvh1-BG/image;s=216x152;q=50","Каменни корита здрави за повече информация на посочения телефон.","Георги","https://www.olx.bg/ads/user/6Lcr0/","Последно онлайн 20 юли 2024 г."
"Спорт, книги, хоби","Уникален Велосипед Simson Suhl 1950","799 лв.","https://frankfurt.apollo.olxcdn.com:443/v1/files/dfu1k7wc0bvh1-BG/image;s=216x152;q=50","Ретро Велосипед Simson Suhl от 1950 - 54г. във много добро състояние и във оригиналния си вид, # simsonsuhl,колекция,колело","Алекс","https://www.olx.bg/ads/user/DTOf/","Последно онлайн 10 септември 2024 г."
"Спорт, книги, хоби","Три пати 2 лева от 1974 година","250 лв.","https://frankfurt.apollo.olxcdn.com:443/v1/files/dfu1k7wc0bvh1-BG/image;s=216x152;q=50","1974 година 2 лева банкнота Може и бартер с доплащане от ваша страна","denislav","https://www.olx.bg/ads/user/pl26i/","Последно онлайн днес в 15:59 ч."
"Спорт, книги, хоби","Сатанизъм unlimited книга","15 лв.","https://frankfurt.apollo.olxcdn.com:443/v1/files/dfu1k7wc0bvh1-BG/image;s=216x152;q=50","Книга за събитията такива каквито са към днешна дата","Маринела Тенева","https://www.olx.bg/ads/user/1sfh/","Последно онлайн 17 август 2024 г."
"Спорт, книги, хоби","Стойка за Микрофон в комплект с два държача, регулеруема","39.90 лв.","https://frankfurt.apollo.olxcdn.com:443/v1/files/dfu1k7wc0bvh1-BG/image;s=216x152;q=50","Една от най качествените стабилни и красиви микрофонни стойки.Масивните крака гарантират стабилност а височината се наглася изключително лесно чрез натискане на ръкохватката! Качествена микрофонна стойка с ръкохватка за регулиране на височината. Чрез стискане на ръкохватката се освобождава вътрешната пружина и се регулира височината. Стойка за микрофон, eдно удължаващо рамо и едно за микрофона, комплект с 2 накрайника. Височината и ъгълът на наклон могат да се регулират свободно според вашите нужди , както и да се върти рамото на 360 градуса , за да се позиционира удобно микрофона на оптималната му височина. Стойката е изработена от лека алуминиева сплав и с неплъзгащи гумени крачета, гарантиращи стабилност по време на използването му. Краката на триножника могат да бъдат сгънати за лесено транспортиране и височината може да бъде регулирана. Регулируемата въртяща ръка разширява обхвата от възможности на стойката. В комплекта са включени два накрайника. Минимална височина: 90 см • Максимална височина с рамото: 200 см • Телескопично рамо: 90/135 см • Хоризонтално рамо ( на микрофона): 70 см • Сгъваема конструкция • Неплъзгащи гумени крачета Всички продукти,които предлагаме са чисто нови , с много добро качество и на конкурентни цени.При закупуването на повече от 1 артикул получавате отстъпка.Доставката е с куриерска фирма Еконт,с опциите- тест , преглед и наложен платеж.За поръчки и информация се обадете на посочения номер или напишете съобщение през приложението * Разгледайте всички мои обяви от менюто по-долу- * ВСИЧКИ ОБЯВИ НА ТОЗИ ПОТРЕБИТЕЛ * тагове: микрофонна стойка промо стойка микрофон","promo55","https://www.olx.bghttp://promo55.olx.bg/home/","Последно онлайн 15 ноември 2024 г."
"Спорт, книги, хоби","Културно-историческо наследство от култа към сакрализираната змия-змей","25 лв.","https://frankfurt.apollo.olxcdn.com:443/v1/files/dfu1k7wc0bvh1-BG/image;s=216x152;q=50","Културно-историческо наследство от култа към сакрализираната змия-змей в земите на тракийските сатри. Автор: Васил Марков. 2009 г., 244 с. Книгата е нова","adeeontop","https://www.olx.bg/ads/user/dWLpG/","Последно онлайн днес в 15:51 ч."
"Спорт, книги, хоби","Намалям до неделя 12лв огромен лот оригинални топки","12 лв.","https://frankfurt.apollo.olxcdn.com:443/v1/files/dfu1k7wc0bvh1-BG/image;s=216x152;q=50","Не разменям Огромен лот от оригинални топки 12 лв за брой Някой топки са чисто нови При интерес на лични съобщения","сис","https://www.olx.bg/ads/user/5scUJ/","Последно онлайн вчера в 17:13 ч."
"Спорт, книги, хоби","Кръвта На мага 1и2","35 лв. По договаряне","https://frankfurt.apollo.olxcdn.com:443/v1/files/dfu1k7wc0bvh1-BG/image;s=216x152;q=50","Чисто нови не са четени. Фентази литература за възрастни. Не ги деля","Milica","https://www.olx.bg/ads/user/16Dj/","Последно онлайн 02 октомври 2024 г."
"Спорт, книги, хоби","Продавам дървен моливник","20 лв.По договаряне","https://frankfurt.apollo.olxcdn.com:443/v1/files/dfu1k7wc0bvh1-BG/image;s=216x152;q=50","Продавам стар дървен моливник. Височина на моливника 16см Отвор в най горната част 7,5см дълбочина на отвора 8 см.","Румен","https://www.olx.bg/ads/user/ANaD/","Последно онлайн 15 ноември 2024 г."
"Спорт, книги, хоби","Фар за велосипед/колело","11.90 лв.","https://frankfurt.apollo.olxcdn.com:443/v1/files/dfu1k7wc0bvh1-BG/image;s=216x152;q=50","МОЛЯ РАЗГЛЕДАЙТЕ НАШИЯ УЕБСАЙТ: www.vista.bg За поръчки направени онлайн през сайта с промо код PC5VS ползвате 5% допълнителна отстъпка. Информация: Водоустойчив USB фар за велосипед. Спецификации: LED интегрална схема: CREE-XPE Осветеност: 300 лумена Време за зареждане: 3 часа от USB Цвят на светлината: 6000к Размер: .6 * 2.9 * 2.2 см Захранване: Вградена 800 mAh литиево-йонна батерия, безопасна и ефективна. Цвят на светлината: 6000к Приложим диаметър на тръбата на превозното средство: 20-40 мм Време на работа: силно осветление 3 часа, слабо осветление 5 часа, премигващо 12 часа","Vista Store","https://www.olx.bghttp://vista.olx.bg/home/","Последно онлайн 08 ноември 2024 г."
