Category,Title,Price,Image URL,Product Details,Author Name,Author Profile Link,Author Last Seen
"Екскурзии, почивки","Нощувки в центъра на Варна","30 лв.","https://frankfurt.apollo.olxcdn.com:443/v1/files/tcrfu4194uu72-BG/image;s=216x152;q=50","Предлагам нощувки в центъра на Варна,в непосредствена близост до централния булевард княз Борис 1 и до всички исторически и административни сгради и учреждения,както и до много кафенета,ресторанти,закусални и атракциони.На 12 минути от централен плаж и красивата Морска градина,на 6 минути от Централна гара.Стаите разполагат с телевизор с кабелна телевизия,климатик,интернет,хладилник,микровълнова печка,пералня. Единична стая-30лв Двойна стая-50лв Апртамент за трима-90лв Хотелски тип стая-60лв Цената за стая зависи от броят на нощувките и силата на сезона.За повече информация на посоченият телефон","димитър","https://www.olx.bg/ads/user/7Mm7/","Последно онлайн 14 ноември 2024 г."
"Екскурзии, почивки","Апартаменти за нощувки на Пампорово","180 лв.","https://frankfurt.apollo.olxcdn.com:443/v1/files/tcrfu4194uu72-BG/image;s=216x152;q=50","Напълно обзаведени, просторни и светли апартаменти, подходящи, както за кратки зимни ски почивки/ летни разхлаждащи, така и за хоум офис. Във всеки апартамент ще намерите: напълно оборудвана кухня, широка тераса, удобен ъглов диван във всекидневната, 42 инчов телевизор, бърз, оптичен интернет със самостоятелен рутер. Зимата температурата в апартамента е поддъжана с локално парно и не пада под 23 градуса, лятото е прохладно с температури в апартаментите около 22 градуса. В сградата разполагате с безплатен достъп до: голям детски кът, лятна тераса с батут, релакс зона с джакузи, класическа сауна, инфрачервена сауна, контрастни вани за ходила; пералня и сушилня, голям паркинг. Срещу допълнително заплащане имате на разположение: билярд и джага, дърва за камините, различни маршрути с офроуд джипове през лятото и моторни шейни през зимата. Ще се радваме да сте наши гости!","Милена","https://www.olx.bg/ads/user/cTz4/","Последно онлайн днес в 14:12 ч."
"Екскурзии, почивки","Двустаен апартамент в Поморие до Роуз гардън","80 лв.По договаряне","https://frankfurt.apollo.olxcdn.com:443/v1/files/tcrfu4194uu72-BG/image;s=216x152;q=50","Апартаментът е разположен в старата част на град Поморие, ул. Европа на 30 метра от плажа и 550 м. от центъра, срещу Айвазовски парк, Роуз гардън (Rose Gardens) и Гранд хотел Поморие (Grand hotel Pomorie) , в близост до ресторанти и магазини. Разположен е на 1-ви жилищен етаж, над гаражи - в сграда с асансьор. Има две отделни стаи: спалня, хол с кухня, антре, баня и тераса с маса и столове. Разполага с два климатика, два телевизора, хладилник, фурна, керамичен котлон, аспиратор, микровълнова печка, сешоар, ютия, дъска за гладене, посуда, спално бельо, хавлии. Осигурени са Wifi интернет и телевизия. Може да се осигури детско креватче/кошарка при необходимост.* Гарантираме за чистота, тишина и всички удобства. * Максималният капацитет на апартамента е за 4 човека (2+2). * Не се допускат домашни любимци. За повече информация, моля посетете нашата фейсбук страница: facebook.com/Radost-Apartments-Pomorie-223583453455","Тодор Александров","https://www.olx.bg/ads/user/zx8h/","Последно онлайн днес в 14:11 ч."
"Екскурзии, почивки","Студио ”Жаклин” Поморие","85 лв.По договаряне","https://frankfurt.apollo.olxcdn.com:443/v1/files/tcrfu4194uu72-BG/image;s=216x152;q=50","Свободни дати 08.06-18.06.24 г. Включително 16.07-21.07; 28.07-31.07; и 24.08-31.08 вкл. Както и от 01.09.2024 г. Студио Жаклин се намира на 100 м от източния плаж и много близо до центъра на ул. ""България"" #13 в стария град. Разположено е на втори жилищен етаж с площ 41 м², в сграда с асансьор. Има капацитет до трима човека. Студиото се състои от една стилно обзаведена стая със спалня и разтегателен фотьойл, кухненски бокс, входно антре, просторна тераса и баня с душ кабина и тоалетна. Помещението е оборудвано с климатик, безжичен интернет, хладилник, ютия, сешоар, керамичен плот с котлони, микровълнова фурна, кафе машина, електрическа кана, домакински съдове, спално бельо, хавлии и всичко необходимо за комфорта на Вашата почивка. Разположението му е много удобно – на крачки от морето, в непосредствена близост до станцията на Софарма, също така и на пешеходно разстояние до главната морска алея, магазини и ресторанти.","Тодор Александров","https://www.olx.bg/ads/user/zx8h/","Последно онлайн днес в 14:11 ч."
"Екскурзии, почивки","Каравана Под Наем ,,Антоанет'' на Къмпинг Градина","100 лв.","https://frankfurt.apollo.olxcdn.com:443/v1/files/tcrfu4194uu72-BG/image;s=216x152;q=50","Очакваме Ви в каравана ""Антоанет"", намираща се на къмпинг Кайт Градина. Караваната разполага с просторна и уютна веранда, оборудвана с всичко необходимо за вашия престой. Две спални, възглавници и олекотени завивки. Не предлагаме чаршафи и хавлии. За ваше удобство има оборудвана кухня с газов котлон, барбекю и посуда, както и зона за релакс с телевизор. За ваше удобство караваната разполага със собствена външна баня и тоалетна. от 1до 15 май- 100ЛВ. От 16 до 31 май- 130ЛВ. От 1 до 15 юни- 150ЛВ. От 16 до 30 юни- 180ЛВ. От 1 юли до 31 август- 220ЛВ. От 1 септем. до 15 септември- 150ЛВ. От 15 септември до 30 септември- 130лв. телефон: 08******77 Романо.","Румен Стоянов","https://www.olx.bg/ads/user/6cEok/","Последно онлайн днес в 13:18 ч."
"Екскурзии, почивки","Каравана Мари на къмпинг Градина- Кайт","100 лв.","https://frankfurt.apollo.olxcdn.com:443/v1/files/tcrfu4194uu72-BG/image;s=216x152;q=50","Очакваме ви в караван Мари, намираща се на къмпинг Кайт-Градина. Караваната разполага с просторна и уютна веранда, оборудвана с всичко необходимо за вашия престой. Две френски спални, възглавници и олекотени завивки. Не предлагаме чаршафи и хавлии. За ваше удобство има оборудвана кухня с газов котлон, барбекю и посуда, както и зона за релакс с телевизор. За ваше удобство, караваната разполага със собственна външна баня- тоалетна. От 1 до 15 май - 100 лв От 16 до 31 май -130лв От 1 до 15 юни - 150 лв От 16 до 30 юни 180 лв От 1 юли до 31 август - 220 лв. От 1-15 септември - 150лв. От 16 септември до 30 септември 130лв телефон- 08******77 Романо.","Румен Стоянов","https://www.olx.bg/ads/user/6cEok/","Последно онлайн днес в 13:18 ч."
"Екскурзии, почивки","Просторен апартамент за Нощувки до четирима души в Студентски град","70 лв.","https://frankfurt.apollo.olxcdn.com:443/v1/files/tcrfu4194uu72-BG/image;s=216x152;q=50","Самостоятелен апартамент 35 лв почасово или 70 лв за нощувка. Предлагаме и подземно паркомясто с топла връзка на цена от 10 лв. Всичко необходимо за дългосрочен или краткосрочен престой. Много подходящ за настаняване на семейства. Дивана е разтегателен и удобен за спане. Отоплението е на климатик. За резервации позвънете на посочения телефон. АДРЕС ул. Акад Борис Стефанов 38","Тиара Имоти","https://www.olx.bghttp://noshtuvki.olx.bg/home/","Последно онлайн днес в 05:22 ч."
"Екскурзии, почивки","""Гларус"" 3-стаен ап. до Морската градина","130 лв.","https://frankfurt.apollo.olxcdn.com:443/v1/files/tcrfu4194uu72-BG/image;s=216x152;q=50","Минимум 3 нощувки! Към общата цена за нощувки се добавя 40 лв за финално почистване и пране на спално бельо! Апартамент за нощувки до Спортна зала, ВИНС, Морско училище и Морската градина. Състои се от дневна, 2 спални, 2 бани + wc, балкон. Едната спалня е с двойно легло и баня+wc към нея, другата е с двойно легло и разтегателен диван, удобен за 1 гост. В дневната има обзаведена кухня с всичко необходимо за готвене и хранене. В коридора има друга баня+wc. Намира се на 3-ти етаж. В сградата няма асансьор. Разрешено за домашни любимци до 10 кг. Доплаща се 50 лв еднократна такса! 3-те стаи са с климатици. Цена за 31.12 - 190 лв (минимум 2 вечери) Условия при резервиране: - Пушенето абсолютно забранено! - Настаняване: след 15:00, напускане: до 11:00. Възможно е по-ранно настаняване (след 9:30) при наличност. Изисква се запитване. - Не се дава за празненства и партита, почасово или почасова работа, която изисква посещението целодневно или денонощно на различни хора (освен поименно споменатите в резервацията) в жилищната сграда и апартамента. - При окончателно напускане на наетото жилище, ключът се оставя на място, уточнено предварително със собственика/управителя или се предава лично на него или на почистващия персонал. - Изисква се 30% невъзвръщаем депозит от цялата сума като гаранция за гостите, че жилището е резервирано за тях и като обезщетение за блокираните дати, ако откажат резервацията. - Собственикът/управителят на апартамента може да върне капарото по всяко време при неочакван наложителен ремонт на наетото жилище или при неволно дублиране на резервацията, ако не може да се осигури друг подобен апартамент. - Нито „Ес Джи Естейтс” нито собственикът на апартамента могат да бъдат подведени под отговорност поради каквито и да били директни или индиректни щети, които могат да възникнат в резултат на използването на апартамента от госта, включително, но не само до повреди на лични вещи, загуби поради пожар, нараняване, кражба или други инциденти. Всички условия и правила за наемане на жилището можете да прочетете на www.varna-shortrent.com/firmena-politika/","Теодор Русев","https://www.olx.bghttp://varna-noshtuvki.olx.bg/home/","Последно онлайн 13 ноември 2024 г."
"Екскурзии, почивки","нощувки Плевен - Апартамент Краси 1 , Идеален център","80 лв.","https://frankfurt.apollo.olxcdn.com:443/v1/files/tcrfu4194uu72-BG/image;s=216x152;q=50","Напълно обзаведен самостоятелен апартамент след основен ремонт на първия етаж в идеалния център на гр. Плевен. Напълно оборудвана кухня, пералня, баня с тоалетна, 2 спални, всекидневна, антре, тераса, 3 телевизора, 3 климатика, безплатен WiFi, частен паркинг. Спалня 1 - легло 160/200, спалня 2 - легло 120/200 и разтегателен диван. Може да се спи и в всекидневната на разтегателен диван.При краткосрочно наемане / над 10 нощувки / - цена по споразумение. Делнични дни - 80 лв. за 2 - ма нощуващи, при 3 - ма или 4 - ма нощуващи се доплаща 10 лв. на човек. Почивни дни - 80 лв. за 2 - ма нощуващи. При 3 - ма или 4 - ма нощуващи се доплаща 10 лв. на човек.","любо","https://www.olx.bg/ads/user/1Qef/","Последно онлайн 14 ноември 2024 г."
"Екскурзии, почивки","Наем на гарсониера, краткосрочно, нощувки","70 лв.По договаряне","https://frankfurt.apollo.olxcdn.com:443/v1/files/tcrfu4194uu72-BG/image;s=216x152;q=50","Свободна от 17.10.2024 г. Гарсониера в Смирненски Прадлага се краткосрочно. В близост до Гребна база, МОЛ Пловдив, Математическа гимназия, Т маркет, болница Пълмед, Каспела. Подходяща за 2+1 човека настаняване. Цена за 2 ма-70 лв, при мин 2 нощувки 80 лв на вечер за семейство с дете до 11 години. 90 лв за трима възрастни. За по-дълъг престой, отстъпка от 10 до 30 %. Разполага с кафе машина,пералня, фурна, индукционен котлон, микровълнова, принцесник, посудса,ютия,гладачна маса. 08********87","Мая","https://www.olx.bg/ads/user/20vb/","Последно онлайн 03 ноември 2024 г."
"Екскурзии, почивки","Апартамент за гости Maritza home Нощувки","90 лв.По договаряне","https://frankfurt.apollo.olxcdn.com:443/v1/files/tcrfu4194uu72-BG/image;s=216x152;q=50","АПАРТАМЕНТЪТ НЕ СЕ ОТДАВА ЗА НЕЛЕГАЛНИ ДЕЙНОСТИ! Апартамент Maritza home се намира в гр. Пловдив, кв. Кършияка, до р. Марица в нова сграда с видеонаблюдение,контролиран достъп, луксозни общи части и асансьор. На 1,4 км. е от центъра на града, на 5 мин. с кола и 15 мин. пешеходна дистанция, на същото разстояние е и Международен панаир Пловдив, а в близост е Университет по хранителни технологии. Апартаментът разполага със спалня, всекидневна с кухненски бокс и кът за хранене, баня с тоалетна и тераса. В спалнята и всекидневната има плоскоекранни телевизори с цифрова телевизия и wi fi на територията на апартамента, както и климатик. Кухнята е напълно оборудвана, за удобство има съдомиялна машина и пералня със сушилня, както и микровълнова фурна и кафемашина. Осигурено е спално бельо и хавлии за гостите. В района паркирането е свободно и има възможност за разходка покрай реката. В близост има 2 големи супермаркета, банкомат, аптека и заведения за хранене. Абсолютно е забранено апартаментът да се ползва за шумни събирания и събития, както и за нелегални дейности! Монтирани са датчици за дим, забранено е тютюнопушенето в стаите и молим гостите да използват терасата, за да запазим чистотата и уюта на апартамента! Забранено е за домашни любимци! Желаем приятен престой в гр. Пловдив!","Маги","https://www.olx.bg/ads/user/2Hh5/","Последно онлайн 30 юни 2024 г."
"Екскурзии, почивки","Бунгало.","160 лв.","https://frankfurt.apollo.olxcdn.com:443/v1/files/tcrfu4194uu72-BG/image;s=216x152;q=50","Местоположението е във вилна зона Митков мост по южното ни Черноморие , на брега на морето в близост до Черноморец. Разстоянието до плажа е, по-малко от 30 метра. Мястото е много подходящ за почивка с деца. Разположение : две спални във всяка спалня има 4 спални места. В едната спалня има двойно легло с размери 140/200 см. и едно разтегателно легло в другата спалня има спалня 160/200 см. и две малки легла 90/200 см. Всяка от спалните е с климатик и със собствен санитарен възел ( баня и тоалетна ). Хол с кухненски бокс (с климатик). Кът за релакс, 1 телевизор , напълно оборудвана кухня (чаши, чинии, посуда, печка с 4 котлона, хладилник с фризер, кафеавтомат с включено кафе, микровълнова печка, ел. скара, барбекю), пералня, възглавници, олекотени завивки, спално бельо, кърпи, самостоятелен двор с маса за хранене , паркомясто. Информация за мястото: Вилната зона е разположена на 20 км южно от Бургас и на 4 км. от Черноморец. В зоната е забранено слушането на силна музика след 23:00 ч.! Настаняването се извършва след 14:00 ч. Напускането е до 11:00 ч. Лице за контакт - Таня 08******77 Цена за нощувка: От 01.06 до 14.06 - 120лв. От 15.06 до 15.09 - 160 лв. От 16.09 до 30.09 - 120лв. Обявената цена е за 4-ри човека, за всеки следващ се доплаща - по 30 лв. Могат да се настанят комфортно 8 човека. Резервации се правят минимум за 5 нощувки. Резервацията се счита за потвърдена при превод на 50% от общата сума по банков път , паричен превод в Еконт или ИзиПей.","Таня","https://www.olx.bg/ads/user/kbyK/","Последно онлайн 08 ноември 2024 г."
"Екскурзии, почивки","Обзаведена Къща под Наем Център в гр Плевен 3-стаен Апартамент","100 лв.","https://frankfurt.apollo.olxcdn.com:443/v1/files/tcrfu4194uu72-BG/image;s=216x152;q=50","100лв е Цената за нущувка при минимум 3х нощувки! Самостоятелна къща в сърцето на гр. Плевен (идеален център, х-л Ростов), на пешеходно разстояние до градската градина, Медицинския Университет, болниците и двата мола. Имотът е обзаведен с всичко необходимо за живеене за 3-ма човека. Представлява трaпезария с кухня и баня на ет. 1 и две спални на ет. 2. Разполага с телевизия, пералня, миялна машина, готварска печка, кафемашина, чаршафи и кърпи Към къщата има самостоятелен двор и голяма тераса с навес","Тони","https://www.olx.bg/ads/user/brEb/","Последно онлайн 12 ноември 2024 г."
