Category,Title,Price,Image URL,Product Details,Author Name,Author Profile Link,Author Last Seen
"Авточасти, аксесоари, гуми и джанти","Джанта с гума за Опел 4х100мм","40 лв.","https://frankfurt.apollo.olxcdn.com:443/v1/files/ntj7n7dhtkxa1-BG/image;s=216x152;q=50","Продавам един брой гума с джанта за 4х100мм междуболтово разстояние. Стоманена джанта 14"" с чисто нова Lassa 175/65R14 гума. Купувана е за резервна гума за Опел Астра, но тъй като от няколко години имам друг комплект джанти с по-голям размер, тази ми е излишна. Състоянието се вижда на снимките.","Станислав","https://www.olx.bg/ads/user/aFC9/","Последно онлайн 12 ноември 2024 г."
"Електроника","Ultra HD проектор Андроид NY300 HY300 - Безжично дублиране на екрана","95 лв.","https://frankfurt.apollo.olxcdn.com:443/v1/files/bxbua772bx202-BG/image;s=216x152;q=50","Описание Основни Характеристики Операционна система Android 11.0: Този проектор е оборудван с най-новата версия на Android, което ви позволява да изтегляте и използвате различни приложения като Netflix, YouTube и други популярни стрийминг услуги. WiFi 6 и BT5.0: Поддръжката на WiFi 6 осигурява бърза и стабилна интернет връзка. Bluetooth 5.0 позволява бързо и надеждно свързване с безжични слушалки, високоговорители и други устройства. Автоматична корекция на трапецовидните изкривявания: Тази функция гарантира, че изображението е правилно и ясно, независимо от мястото, където е поставен проекторът. 180-градусов ъгъл на гледане: Широкият ъгъл на гледане позволява комфортно гледане от различни позиции. 130-инчов екран: Проекторът може да проектира изображения с размер до 130 инча, осигурявайки голям и впечатляващ дисплей, идеален за домашно кино. Поддръжка на 4K: Поддръжката на 4K резолюция предоставя висококачествени и ясни изображения, създавайки превъзходно изживяване при гледане на филми, игри и други мултимедийни съдържания. Разнообразие от връзки: С HDMI, USB и AV входове, проекторът е съвместим с телефони, компютри, лаптопи, PS5 и медийни плейъри, което позволява лесно свързване към различни източници. Приложения Домашно кино: С висока резолюция и голям екран, проекторът е идеален за създаване на кино изживяване у дома. Образование: Подходящ за училища и образователни центрове за представяне на визуални материали. Бизнес презентации: Идеален за офиси и бизнес среди за провеждане на презентации и срещи. Игри: Съвместимостта с PS5 и други конзоли предлага изключително игрово изживяване на голям екран. Предимства Лесна инсталация и употреба: С Android 11.0 и автоматична корекция на трапецовидните изкривявания, проекторът е удобен за използване. Високо качество: 4K поддръжката и големият екран осигуряват превъзходно изживяване при гледане. Многофункционалност: Съвместимостта с различни устройства го прави подходящ за разнообразни приложения. Mini Projector HY300 Pro Wifi 6 BT5.0 е високопроизводителен и многофункционален проектор, идеален за домашно кино, образование и бизнес презентации.","Yes Global EOOD","https://www.olx.bg/ads/user/nhgyD/","Последно онлайн вчера в 11:01 ч."
"Електроника","Mонтаж,Демонтаж,Продажба","250 лв.","https://frankfurt.apollo.olxcdn.com:443/v1/files/bxbua772bx202-BG/image;s=216x152;q=50","СТАНДАРТЕН МОНТАЖ -3 лм.траб МОНТАЖ :9 000/16 000 BTU -250 Лв МОНТАЖ :16 000/18 000BTU-300 Лв МОНТАЖ :18 000/24 000 BTU-350Лв РАИОН СОФИЯ ДО 20 КМ БЕЗПЛАТНО ,НА ПОВЕЧЕ ОТ 20 КМ СЕ ДОПЛАЩА НА МОНТАЖНАТА ГРУПА ПО 1.50 НА КМ ПРОДАЖБИ НА КЛМАТИЦИ !! СЕ ИЗВЪРШВАТ НА ПОСОЧЕНИЯ ТЕЛ ПРОФИЛАКТИКА !! 9 000/16 000 BTU -120 лв 16 000/18 000BTU-150 лв 18 000/24 000BTU-180 лв ПЪЛНЕНЕ С ФРЕОН !!! R32 -140 ЛВ R410 -180 ЛВ ДЕМОНТАЖ НА КЛИМАТИЦИ 9 000/12 000-120 ЛВ 12 000/16 000 -140 ЛВ 18 000/24 000-180 Л","Aqua Clima","https://www.olx.bg/ads/user/ftLvI/","Последно онлайн 04 ноември 2024 г."
"Електроника","Smartwatch smart watch t900 ultra iwatch","30 лв.","https://frankfurt.apollo.olxcdn.com:443/v1/files/bxbua772bx202-BG/image;s=216x152;q=50","Часовникът предлага изключителни функции като възможност за провеждане на разговори директно от него, получаване на нотификации от вашия смартфон и проследяване на спортни активности и данни за физическа активност. Благодарение на мулти-спорт режима и вградения крачкомер, T900 Ultra ви помага да следите и подобрявате вашата активност в рамките на всяка физическа дейност. Водоустойчив Мулти-спорт режим Комплектът включва 1 бр. х Смарт часовник; 1 бр. х Инструкция за употреба; 1 бр. х Кабел за зареждане;","Паскал","https://www.olx.bg/ads/user/lJwjj/","Последно онлайн 13 ноември 2024 г."
"Електроника","Кейс за Iphone XR","10 лв.","https://frankfurt.apollo.olxcdn.com:443/v1/files/bxbua772bx202-BG/image;s=216x152;q=50","Кейс за Iphone XR за 10 лв с десен.","Lubenova_ign","https://www.olx.bg/ads/user/9prFP/","Последно онлайн 24 октомври 2024 г."
"Електроника","HP G2 Безжични Слушалки","95 лв.","https://frankfurt.apollo.olxcdn.com:443/v1/files/bxbua772bx202-BG/image;s=216x152;q=50","HP G2 Безжични Слушалки Марка: HP Цвят: Черно/Бяло Разположение на слушалките: Над ушите (Over Ear) Форм-фактор: В ушите (In Ear) Контрол на шума: Звукова изолация Тип жак: USB Технология на свързване: Безжична Безжична комуникация: Bluetooth Комплектът включва: HP Безжични слушалки Зарядно калъфче USB-C към A зареден кабел (0.5m) 3 накрайника за уши (S/M/L) Брошура за бърз старт Карта с информация за продукта Гаранционна карта Основни характеристики: Подавяне на шум: Технологията за цифрово обработване на звука (DSP) намалява фоновия шум и елиминира ехото, позволявайки ви да контролирате звука с вградените сензори за допир. По-добра свързаност: С Bluetooth 5, получавате два пъти по-висока скорост и четири пъти по-широк обхват на свързване. Продължителност на батерията: Вградената батерия предоставя до 4 часа аудио работа, а магнитното зарядно калъфче осигурява допълнителни 12 часа слушане. Съвместимост: Слушалките са съвместими с таблети, смартфони, компютри и други устройства с Bluetooth. С HP G2 безжичните слушалки, вие ще се насладите на висококачествен звук и удобно слушане без ненужен шум. Идеални за работа, игри или просто за слушане на музика, те съчетават комфорт и технология в едно! Разгледайте и останалите ни предложения на www.prosolutions.bg. В Pro Solutions се фокусираме върху реновирането на компютърна техника от висок клас, като активно участваме в кръговата икономика. Много компании в Европа обновяват своята техника на всеки 3-5 години, и ние поемаме тези качествени устройства, които все още разполагат с много ресурси. Нашият процес на реновиране включва цялостна диагностика, визуална инспекция, дълбочинно почистване и замяна на износени компоненти с нови, проверени части, след което извършваме повторни тестове за гарантиране на качество и надеждност. В допълнение на това, може да разчитате на нас и в търсенето на нови висококачествени стоки от доказани производители. Съчетанието на реновирани и нови устройства ни позволява да предоставим на клиентите разнообразни решения, които отговарят на нуждите както на бизнеса, така и на личната употреба. Ние сме ангажирани да предлагаме на клиентите най-доброто на достъпни цени, независимо от избора между реновирани и нови изделия. Какво предлагаме: - Рационални решения, адаптирани към вашите нужди. - Висока клиентска удовлетвореност и внимание към детайлите. - Над 99% положителни отзиви от клиенти. - Реална писмена гаранция с възможност за удължаване. - Собствен гаранционен сервиз и прилагане на оборотна техника, когато е възможно. - Право на връщане в рамките на 30 дни. - Данъчна фактура/касова бележка за всяка поръчка. - Отстъпки при поръчка на повече артикули. - Безплатна доставка до офис на Спиди или Еконт за поръчки над 199 лв. - Опции за SMS известяване и преглед/тест преди плащане. Всяка реновирана техника има статус, който обозначава визуалното ѝ състояние: (А) - Отлично визуално състояние с малки драскотини. (А-) - Много добро състояние с повече забележки. (B) - Добро състояние с по-сериозни визуални забележки. Реновираната техника е чудесен начин да получите високо качество на добра цена. Заповядайте в www.prosolutions.bg и разгледайте нашите предложения!","Pro Solutions","https://www.olx.bghttp://prosolutions.olx.bg/home/","Последно онлайн вчера в 20:16 ч."
"Електроника","HP Engage 14t Тъч Монитор USB-C/със стойка","399 лв.","https://frankfurt.apollo.olxcdn.com:443/v1/files/bxbua772bx202-BG/image;s=216x152;q=50","Състояние: Нов запечатан Модел: Engage 14t Part N: 20C51AA#AC3 Спецификации: Размер: 14"" Производител: HP Модел: Engage 14t Размер екран: 14 inch Резолюция: 1920x1080 Контраст: 800:1 Яркост: 400 cd/m2 Съотношение: 16:9 Покритие на дисплея: GLOSSY Камера: 5mP Интерфейси: USB Type C Гаранция: 12 месеца Разгледайте и останалите ни предложения на www.prosolutions.bg. В Pro Solutions се фокусираме върху реновирането на компютърна техника от висок клас, като активно участваме в кръговата икономика. Много компании в Европа обновяват своята техника на всеки 3-5 години, и ние поемаме тези качествени устройства, които все още разполагат с много ресурси. Нашият процес на реновиране включва цялостна диагностика, визуална инспекция, дълбочинно почистване и замяна на износени компоненти с нови, проверени части, след което извършваме повторни тестове за гарантиране на качество и надеждност. В допълнение на това, може да разчитате на нас и в търсенето на нови висококачествени стоки от доказани производители. Съчетанието на реновирани и нови устройства ни позволява да предоставим на клиентите разнообразни решения, които отговарят на нуждите както на бизнеса, така и на личната употреба. Ние сме ангажирани да предлагаме на клиентите най-доброто на достъпни цени, независимо от избора между реновирани и нови изделия. Какво предлагаме: - Рационални решения, адаптирани към вашите нужди. - Висока клиентска удовлетвореност и внимание към детайлите. - Над 99% положителни отзиви от клиенти. - Реална писмена гаранция с възможност за удължаване. - Собствен гаранционен сервиз и прилагане на оборотна техника, когато е възможно. - Право на връщане в рамките на 30 дни. - Данъчна фактура/касова бележка за всяка поръчка. - Отстъпки при поръчка на повече артикули. - Безплатна доставка до офис на Спиди или Еконт за поръчки над 199 лв. - Опции за SMS известяване и преглед/тест преди плащане. Всяка реновирана техника има статус, който обозначава визуалното ѝ състояние: (А) - Отлично визуално състояние с малки драскотини. (А-) - Много добро състояние с повече забележки. (B) - Добро състояние с по-сериозни визуални забележки. Реновираната техника е чудесен начин да получите високо качество на добра цена. Заповядайте в www.prosolutions.bg и разгледайте нашите предложения","Pro Solutions","https://www.olx.bghttp://prosolutions.olx.bg/home/","Последно онлайн вчера в 20:16 ч."
"Електроника","Конвекторна печка, 2000W с 2 години гаранция","59.99 лв.","https://frankfurt.apollo.olxcdn.com:443/v1/files/bxbua772bx202-BG/image;s=216x152;q=50","Тип продукт : Уред за отопление; Конвекторната печка TR2013B с мощност 2000W е идеален избор за бързо и ефективно отопление на помещения. С компактния си и елегантен дизайн, тя лесно се вписва във всякакъв интериор. Печката разполага с регулатор на температурата, който ви позволява да настроите желаното ниво на топлина, и функция за защита от прегряване, която осигурява безопасна работа. Също така, моделът е лесен за преместване благодарение на вградените си колелца и дръжка. Подходяща е за отопление на малки до средни помещения и предлага надеждно решение за комфорт в студените дни; 24 месеца гаранция.","Марио","https://www.olx.bg/ads/user/orqX5/","Последно онлайн 12 ноември 2024 г."
"Електроника","HP Engage 14"" Монитор USB-C/без стойка","199 лв.","https://frankfurt.apollo.olxcdn.com:443/v1/files/bxbua772bx202-BG/image;s=216x152;q=50","Състояние: Нов запечатан Модел: Engage 14 Part N: M23197-009 Спецификации: Размер: 14"" Производител: HP Модел: Engage 14 Размер екран: 14 inch Резолюция: 1920x1080 Контраст: 800:1 Яркост: 400 cd/m2 Съотношение: 16:9 Покритие на дисплея: GLOSSY Интерфейси: USB Type C Гаранция: 12 месеца Разгледайте и останалите ни предложения на www.prosolutions.bg. В Pro Solutions се фокусираме върху реновирането на компютърна техника от висок клас, като активно участваме в кръговата икономика. Много компании в Европа обновяват своята техника на всеки 3-5 години, и ние поемаме тези качествени устройства, които все още разполагат с много ресурси. Нашият процес на реновиране включва цялостна диагностика, визуална инспекция, дълбочинно почистване и замяна на износени компоненти с нови, проверени части, след което извършваме повторни тестове за гарантиране на качество и надеждност. В допълнение на това, може да разчитате на нас и в търсенето на нови висококачествени стоки от доказани производители. Съчетанието на реновирани и нови устройства ни позволява да предоставим на клиентите разнообразни решения, които отговарят на нуждите както на бизнеса, така и на личната употреба. Ние сме ангажирани да предлагаме на клиентите най-доброто на достъпни цени, независимо от избора между реновирани и нови изделия. Какво предлагаме: - Рационални решения, адаптирани към вашите нужди. - Висока клиентска удовлетвореност и внимание към детайлите. - Над 99% положителни отзиви от клиенти. - Реална писмена гаранция с възможност за удължаване. - Собствен гаранционен сервиз и прилагане на оборотна техника, когато е възможно. - Право на връщане в рамките на 30 дни. - Данъчна фактура/касова бележка за всяка поръчка. - Отстъпки при поръчка на повече артикули. - Безплатна доставка до офис на Спиди или Еконт за поръчки над 199 лв. - Опции за SMS известяване и преглед/тест преди плащане. Всяка реновирана техника има статус, който обозначава визуалното ѝ състояние: (А) - Отлично визуално състояние с малки драскотини. (А-) - Много добро състояние с повече забележки. (B) - Добро състояние с по-сериозни визуални забележки. Реновираната техника е чудесен начин да получите високо качество на добра цена. Заповядайте в www.prosolutions.bg и разгледайте нашите предложения","Pro Solutions","https://www.olx.bghttp://prosolutions.olx.bg/home/","Последно онлайн вчера в 20:16 ч."
